{
  "$schema": "../schema/station.schema.json",
  "id": "s06",
  "number": 6,
  "title": "Renderer",
  "label": "Renderer (example)",
  "place": "Off-site",
  "greybox": true,
  "evidence": [
    "SPEC-journey"
  ],
  "set": {
    "blend": "art/blender/s06_renderer.blend",
    "renders": "public/assets/stations/s06/",
    "lighting": "midday"
  },
  "runs": {
    "2": {
      "summary": "The kilo goes through a typical rendering process and comes out as meat and bone meal, and oil.",
      "proposed": true,
      "prompts": {
        "start": "Turn the kilo into something useful",
        "next": "Next machine",
        "leave": "See it used"
      }
    }
  },
  "blueprint": {
    "2": [
      {
        "lane": "backstage",
        "text": "Renderer (example) turns the crates into meat and bone meal, and oil, in a typical sequence.",
        "evidence": [
          "SPEC-journey"
        ],
        "proposed": true
      },
      {
        "lane": "support",
        "text": "The collector agreement links the hub and the renderer.",
        "evidence": [
          "SPEC-journey"
        ],
        "proposed": true
      },
      {
        "lane": "evidence",
        "text": "Rendering steps are a typical process, not a specific plant.",
        "evidence": [
          "SPEC-journey"
        ]
      }
    ]
  },
  "params": {
    "process_label": "Typical process",
    "stages": [
      {
        "chip": "Bone & offal",
        "caption": "Bone and offal, from the hub"
      },
      {
        "chip": "Crushed",
        "caption": "Size reduction: crushed small"
      },
      {
        "chip": "Cooked",
        "caption": "Cooking: sterilised, the fat lets go"
      },
      {
        "chip": "Pressed",
        "caption": "Pressing: the oil runs off, a dry cake stays"
      },
      {
        "chip": "Meal",
        "caption": "Drying and milling: a fine meal"
      }
    ],
    "product": {
      "chip": "Product",
      "meal": "Meat and bone meal",
      "oil": "Oil",
      "uses": "Typical uses: animal feed, fertiliser"
    },
    "inset_label": "Now",
    "evidence_note": "Rendering evidence ids pending research/evidence.csv"
  }
}
