{
  "$schema": "../schema/station.schema.json",
  "id": "s07",
  "number": 7,
  "title": "The meal in use",
  "label": "How it could close",
  "place": "A small farm",
  "greybox": true,
  "evidence": [
    "SPEC-journey",
    "C-kannur",
    "D-p22"
  ],
  "set": {
    "blend": "art/blender/s07_loop.blend",
    "renders": "public/assets/stations/s07/",
    "lighting": "midday"
  },
  "runs": {
    "2": {
      "summary": "The meal from the kilo feeds a flock and a vegetable bed: how the loop could close.",
      "proposed": true,
      "prompts": {
        "feed": "Feed the hens",
        "soil": "Feed the soil",
        "leave": "See the day's ledger"
      }
    }
  },
  "blueprint": {
    "2": [
      {
        "lane": "backstage",
        "text": "Meat and bone meal sold to farms, as feed and as fertiliser.",
        "evidence": [
          "SPEC-journey",
          "C-kannur"
        ],
        "proposed": true
      },
      {
        "lane": "frontstage",
        "text": "A farmer feeds the flock and the vegetable beds from the renderer's sacks.",
        "evidence": [
          "SPEC-journey"
        ],
        "proposed": true
      },
      {
        "lane": "evidence",
        "text": "Kannur precedent; no supply chain back to the stall was found.",
        "evidence": [
          "C-kannur",
          "SPEC-journey"
        ]
      }
    ]
  },
  "params": {
    "uses": [
      {
        "key": "feed",
        "caption": "Meal in the feed: protein for the flock"
      },
      {
        "key": "soil",
        "caption": "Bone meal in the soil: food for the crop"
      }
    ],
    "precedent": "Precedent: Kannur, Kerala",
    "caveat": "No supply chain back to the stall was found"
  }
}
