{
  "$schema": "../schema/station.schema.json",
  "id": "s03",
  "number": 3,
  "title": "Weigh-in and payment",
  "place": "The hub's front counter",
  "greybox": true,
  "evidence": [
    "SPEC-journey",
    "D-p23",
    "D-p20",
    "D-p26",
    "D-p22",
    "C-mbm-price",
    "C-render-yield"
  ],
  "runs": {
    "2": {
      "summary": "The kilo is weighed, recorded by voice and paid by UPI.",
      "proposed": true,
      "prompts": {
        "sort": "Sort it: crate or bin",
        "drag": "Put the crate on the scale",
        "number": "Talk to the attendant",
        "wait": "The attendant types it in",
        "paid": "Paid",
        "leave": "Into the cold room"
      }
    }
  },
  "blueprint": {
    "2": [
      {
        "lane": "vendor",
        "text": "Puts the crate on the scale and talks it through with the attendant.",
        "evidence": [
          "SPEC-journey",
          "D-p23"
        ],
        "proposed": true
      },
      {
        "lane": "frontstage",
        "text": "Attendant, scale and rate board; the slip comes on WhatsApp.",
        "evidence": [
          "SPEC-journey",
          "D-p20"
        ],
        "proposed": true
      },
      {
        "lane": "backstage",
        "text": "The rate is set with the collector agreement.",
        "evidence": [
          "SPEC-journey"
        ],
        "proposed": true
      },
      {
        "lane": "support",
        "text": "UPI payment, confirmed by sound.",
        "evidence": [
          "SPEC-journey",
          "D-p26"
        ],
        "proposed": true
      },
      {
        "lane": "evidence",
        "text": "Empathy map: wet hands make the phone uncomfortable; interview 04: typing slows them down.",
        "evidence": [
          "D-p23",
          "D-p26"
        ]
      }
    ]
  },
  "params": {
    "weight_label": "1.0 kg",
    "rate_board": [
      {
        "line": "Bone, sorted",
        "rate": "≈₹3/kg"
      },
      {
        "line": "Offal, sorted",
        "rate": "≈₹3/kg"
      },
      {
        "line": "Mixed",
        "rate": "≈₹1/kg"
      }
    ],
    "rate_note": "Estimates · sorted earns more",
    "speech": "My number is…",
    "number_masked": "••••• •••••",
    "slip": {
      "title": "Hub slip",
      "lines": [
        "1.0 kg · sorted",
        "≈₹3 by UPI"
      ],
      "lines_mixed": [
        "1.0 kg · mixed",
        "≈₹1 by UPI"
      ]
    },
    "tag_after": {
      "label": "Hub payout",
      "value": "+₹3",
      "meaning": "income",
      "note": "Estimate: ₹3/kg sorted"
    },
    "tag_after_mixed": {
      "label": "Hub payout",
      "value": "+₹1",
      "meaning": "income",
      "note": "Estimate: ₹1/kg mixed"
    },
    "talk_note": "The weigh-in as it might sound at a Shivajinagar counter: Dakhni and English, the way the market talks. The rates are our estimate (see endcard payout_note); the number is never shown.",
    "talk": [
      {
        "who": "attendant",
        "text": "Salaam, Riyaz bhai! Rakh do, rakh do. Ek kilo, full.",
        "mixed": "Salaam, Riyaz bhai! Ek kilo… arre, plastic dikh raha hai andar."
      },
      {
        "who": "riyaz",
        "text": "Walaikum salaam. All sorted at the stall itself. Aaj ka rate kya hai?",
        "mixed": "Arre, rush mein gir gaya hoga. Rate kya hai?"
      },
      {
        "who": "attendant",
        "text": "Sorted hai na, so ₹3 a kilo. Number bolo.",
        "mixed": "Mixed hai, bhai, so only ₹1 a kilo. Next time alag karo. Number bolo."
      },
      {
        "who": "riyaz",
        "text": "Same as last time. Nine-eight… you have it, no?",
        "do": "mask"
      },
      {
        "who": "attendant",
        "text": "Hau, hau. Done. Phone dekho.",
        "do": "pay"
      },
      {
        "who": "riyaz",
        "text": "Aa gaya! Shukriya, bhai."
      },
      {
        "who": "attendant",
        "text": "Khuda hafiz. Meat bacha toh Chamber A mein rakh do, free hai."
      }
    ],
    "speakers": {
      "riyaz": "Riyaz",
      "attendant": "Hub attendant"
    },
    "sort": {
      "title": "Sort before you weigh",
      "keep_label": "Into the crate",
      "reject_label": "Not for the hub",
      "keys": "← crate · bin →",
      "count": "{n} of {total}",
      "done": "Sorted",
      "score": "{right} of {total} sorted right",
      "verdict_clean": "A clean crate: the sorted rate",
      "verdict_mixed": "Rubbish in the crate: the mixed rate",
      "verdict_lost": "Meat waste in the bin is value thrown away",
      "items": [
        {
          "label": "Bone-in offcut",
          "kind": "bone",
          "keep": true,
          "why": "Bone is meat waste: it goes in the crate"
        },
        {
          "label": "Carry bag",
          "kind": "bag",
          "keep": false,
          "why": "Plastic is not meat waste"
        },
        {
          "label": "Liver",
          "kind": "liver",
          "keep": true,
          "why": "Offal is meat waste: it goes in the crate"
        },
        {
          "label": "Paper tea cup",
          "kind": "cup",
          "keep": false,
          "why": "A tea cup is not meat waste"
        },
        {
          "label": "Rib offcut",
          "kind": "ribs",
          "keep": true,
          "why": "Bone is meat waste: it goes in the crate"
        },
        {
          "label": "Twine",
          "kind": "string",
          "keep": false,
          "why": "Twine is not meat waste"
        },
        {
          "label": "Fat trim",
          "kind": "fat",
          "keep": true,
          "why": "Fat is meat waste: it goes in the crate"
        },
        {
          "label": "Newspaper wrap",
          "kind": "paper",
          "keep": false,
          "why": "Paper is not meat waste"
        },
        {
          "label": "Gut",
          "kind": "gut",
          "keep": true,
          "why": "Offal is meat waste: it goes in the crate"
        },
        {
          "label": "Foam tray",
          "kind": "tray",
          "keep": false,
          "why": "Thermocol is not meat waste"
        },
        {
          "label": "Chicken skin",
          "kind": "skin",
          "keep": true,
          "why": "Skin is meat waste: it goes in the crate"
        }
      ]
    }
  },
  "set": {
    "blend": "art/blender/s03_weigh.blend",
    "renders": "public/assets/stations/s03/",
    "lighting": "midday"
  }
}
